{
  "$schema": "https://w3id.org/modavis/vao/0.6.0/schema/carrier.json",
  "carrierMode": "preservation-closure",
  "completeGroupIds": [
    "urn:uuid:0b2e2393-0ba3-5864-8774-1db2f468194f",
    "urn:uuid:7627fee9-c7c5-5737-b3b9-271b92409439"
  ],
  "embeddedRealizations": [
    {
      "path": "payload/reference.py",
      "realizationId": "urn:uuid:3a98db5d-4fa3-5f69-a127-ee6fc69d8a8d"
    },
    {
      "path": "payload/observation.svg",
      "realizationId": "urn:uuid:7ed323b3-ba22-5e2c-9c8c-9e13d5136592"
    },
    {
      "path": "payload/semantic.json",
      "realizationId": "urn:uuid:f22ff5e8-b6c6-5504-857f-3a522f574a6e"
    },
    {
      "path": "payload/requirements-lock.txt",
      "realizationId": "urn:uuid:f383f380-074d-56af-a60b-b1bcdc0445f0"
    },
    {
      "path": "payload/evidence.txt",
      "realizationId": "urn:uuid:fa570f35-9514-5e52-9e70-c1207c8fdd6c"
    }
  ],
  "formatVersion": "0.6.0",
  "id": "urn:uuid:defed60f-d50e-5f2c-ab92-6f88e2b39324",
  "manifestByteSize": 16861,
  "manifestSHA256": "a90e499ada2c463d0f91651ff9454f3a537255a2f65a246d4a69201b0f5827da",
  "releaseId": "urn:uuid:e3982723-97ae-5426-aa75-e67348b74146",
  "type": "VAOCarrier"
}
