{
  "$schema": "https://w3id.org/modavis/vao/0.6.0/schema/carrier.json",
  "carrierMode": "bootstrap",
  "completeGroupIds": [
    "urn:uuid:8204595b-f343-5b22-9a62-d8aefb0238cd"
  ],
  "embeddedRealizations": [
    {
      "path": "payload/semantic.json",
      "realizationId": "urn:uuid:1a932487-00e0-5232-8ab6-649f5755ef66"
    },
    {
      "path": "payload/reference.py",
      "realizationId": "urn:uuid:ad0cf6b0-d348-5f56-ab20-898b18c650bd"
    },
    {
      "path": "payload/requirements-lock.txt",
      "realizationId": "urn:uuid:719bf0a3-6d7c-51bf-9eb5-9ec6c2ac5284"
    },
    {
      "path": "payload/evidence.txt",
      "realizationId": "urn:uuid:8223a6fc-508c-572c-a950-effaed32a0d9"
    }
  ],
  "formatVersion": "0.6.0",
  "id": "urn:uuid:45b51835-deb6-531a-90a7-22bd92d21d2a",
  "manifestByteSize": 18465,
  "manifestSHA256": "a38109a0e81e4d528e57a01238db0f89e76e97acf9f07779e4ac859378e57b5e",
  "releaseId": "urn:uuid:dd9b8c30-12db-5a79-8609-a92d5950ea3f",
  "type": "VAOCarrier"
}
