{
  "$schema": "https://w3id.org/modavis/vao/0.6.0/schema/carrier.json",
  "carrierMode": "bootstrap",
  "completeGroupIds": [
    "urn:uuid:72f10fbb-f84d-5e58-a36d-f8beb00b274e"
  ],
  "embeddedRealizations": [
    {
      "path": "payload/semantic.json",
      "realizationId": "urn:uuid:bf47c7bd-c135-5da0-b628-e64ce718877f"
    },
    {
      "path": "payload/reference.py",
      "realizationId": "urn:uuid:1baa6489-3c7d-5c39-8cb6-c25f02221b2e"
    },
    {
      "path": "payload/requirements-lock.txt",
      "realizationId": "urn:uuid:8d45603a-077b-5b37-b386-63c9609abb16"
    },
    {
      "path": "payload/evidence.txt",
      "realizationId": "urn:uuid:8ae219bc-9970-586b-8dd5-ff5c1f1c35f4"
    }
  ],
  "formatVersion": "0.6.0",
  "id": "urn:uuid:79e7b81b-a787-5bed-b0bf-f9c99d2e6a18",
  "manifestByteSize": 21517,
  "manifestSHA256": "61b592a840735d5b7f4e4827070cc996b8522cee83284b19a3c69b05b71ba8a2",
  "releaseId": "urn:uuid:67475a4e-bcb6-5a32-938c-4a97df956ea4",
  "type": "VAOCarrier"
}
