{
  "$schema": "https://w3id.org/modavis/vao/0.6.0/schema/carrier.json",
  "carrierMode": "bootstrap",
  "completeGroupIds": [
    "urn:uuid:1957f03f-0695-5277-81fb-539a09e21a8f"
  ],
  "embeddedRealizations": [
    {
      "path": "payload/semantic.json",
      "realizationId": "urn:uuid:2b4c9c05-3737-5a6b-812a-94456c9276eb"
    },
    {
      "path": "payload/reference.py",
      "realizationId": "urn:uuid:b108d93e-d783-59b4-8e18-21e0701d064d"
    },
    {
      "path": "payload/requirements-lock.txt",
      "realizationId": "urn:uuid:5d7f2c1b-9588-5fae-83ba-dda1eb8f0f55"
    },
    {
      "path": "payload/evidence.txt",
      "realizationId": "urn:uuid:bc9860da-8721-585b-ac09-79473db878d9"
    }
  ],
  "formatVersion": "0.6.0",
  "id": "urn:uuid:a7513ea9-db33-5d0f-8cb5-37bfdb9eda55",
  "manifestByteSize": 19972,
  "manifestSHA256": "cbc156bd05bfc68736a5be423bcdd162cae51dcfd4c4913c107d32d2668f4bf9",
  "releaseId": "urn:uuid:90065e0f-95fb-564c-bc6f-9a2129c9553e",
  "type": "VAOCarrier"
}
