{
  "$schema": "https://w3id.org/modavis/vao/0.6.0/schema/carrier.json",
  "carrierMode": "preservation-closure",
  "completeGroupIds": [
    "urn:uuid:42533abd-1f0f-5d80-9814-9101228a9ef5",
    "urn:uuid:507ea187-7375-597a-8078-762b12ab4773"
  ],
  "embeddedRealizations": [
    {
      "path": "payload/reference.py",
      "realizationId": "urn:uuid:1a2ef335-5bcb-54d0-b65c-af060e40ba39"
    },
    {
      "path": "payload/export.mid",
      "realizationId": "urn:uuid:1d2dfef9-a6c8-517f-b210-08dd4e78f31a"
    },
    {
      "path": "payload/native.json",
      "realizationId": "urn:uuid:43ebd5a7-2393-5f7e-b2dd-974434e216d2"
    },
    {
      "path": "payload/evidence.txt",
      "realizationId": "urn:uuid:4654ec2a-f102-5331-b7b4-6799d772b02d"
    },
    {
      "path": "payload/requirements-lock.txt",
      "realizationId": "urn:uuid:5b6e3936-5499-5bfe-aac6-39d4e3d1212b"
    },
    {
      "path": "payload/observation.svg",
      "realizationId": "urn:uuid:d0e68be0-80bb-5ad1-a99f-243b360057ce"
    },
    {
      "path": "payload/semantic.json",
      "realizationId": "urn:uuid:f50dd32d-f38a-5d8e-bee8-7cdae2f2a27c"
    }
  ],
  "formatVersion": "0.6.0",
  "id": "urn:uuid:23288edb-0f47-50c2-8800-5f1ffc5649c4",
  "manifestByteSize": 19961,
  "manifestSHA256": "071b0e1bd1832f93b42da7419881bcd1277aa0f28e5aee24e8ed025551f52644",
  "releaseId": "urn:uuid:b6e020a7-7747-5fd3-b5e3-9bc913507fa2",
  "type": "VAOCarrier"
}
