{
  "$schema": "https://w3id.org/modavis/vao/0.6.0/schema/carrier.json",
  "carrierMode": "bootstrap",
  "completeGroupIds": [
    "urn:uuid:eae5b48b-be42-55c9-977e-d51607c3d803"
  ],
  "embeddedRealizations": [
    {
      "path": "payload/semantic.json",
      "realizationId": "urn:uuid:3d6126ff-2ad0-50b3-9d5c-96ba8ef1347d"
    },
    {
      "path": "payload/reference.py",
      "realizationId": "urn:uuid:7e218b08-3be8-5148-b0d5-4842ed5079b4"
    },
    {
      "path": "payload/requirements-lock.txt",
      "realizationId": "urn:uuid:f180d6ba-1622-5afe-94ea-c80918b10d33"
    },
    {
      "path": "payload/evidence.txt",
      "realizationId": "urn:uuid:e2945115-a1b6-50c7-9f1d-b89a5d0ef51c"
    }
  ],
  "formatVersion": "0.6.0",
  "id": "urn:uuid:845dcb84-2220-57b2-94a8-f2bac9fd1b65",
  "manifestByteSize": 19973,
  "manifestSHA256": "6f995f53dfffbb2ed390d86af4e71d4a07b4d769ba893585b969e70e960cabe7",
  "releaseId": "urn:uuid:f61b4fbc-1bec-5366-aeef-6d54414e12d3",
  "type": "VAOCarrier"
}
