{
  "$schema": "https://w3id.org/modavis/vao/0.6.0/schema/carrier.json",
  "carrierMode": "bootstrap",
  "completeGroupIds": [
    "urn:uuid:cbe1e9e0-8651-5d91-a4ed-f2a42e366ddc"
  ],
  "embeddedRealizations": [
    {
      "path": "payload/semantic.json",
      "realizationId": "urn:uuid:4c163ea7-3815-50e0-be1a-a39a3f980c45"
    },
    {
      "path": "payload/reference.py",
      "realizationId": "urn:uuid:c76cc5e4-fa46-5946-8a5b-9c989d5a14fd"
    },
    {
      "path": "payload/requirements-lock.txt",
      "realizationId": "urn:uuid:a2e8712c-99a0-54c7-adde-63227e2e4277"
    },
    {
      "path": "payload/evidence.txt",
      "realizationId": "urn:uuid:5dc62bdc-943f-5a4c-8b98-d862bed32d34"
    }
  ],
  "formatVersion": "0.6.0",
  "id": "urn:uuid:557ea8aa-3196-51ba-aac3-12b489a6ab44",
  "manifestByteSize": 23287,
  "manifestSHA256": "c9f3d244d2b074586c7a6d54765efb997faa7ccbf9014eb5b890da65ed70b502",
  "releaseId": "urn:uuid:10b073d9-1edd-5224-add5-920adbee867e",
  "type": "VAOCarrier"
}
