{
  "$schema": "https://w3id.org/modavis/vao/0.6.0/schema/carrier.json",
  "carrierMode": "preservation-closure",
  "completeGroupIds": [
    "urn:uuid:eae5b48b-be42-55c9-977e-d51607c3d803",
    "urn:uuid:8c567909-96b9-57be-8ca4-3942b7da3acf"
  ],
  "embeddedRealizations": [
    {
      "path": "payload/native.json",
      "realizationId": "urn:uuid:0610ea70-2070-5bfb-b2a7-b477afd9203e"
    },
    {
      "path": "payload/semantic.json",
      "realizationId": "urn:uuid:3d6126ff-2ad0-50b3-9d5c-96ba8ef1347d"
    },
    {
      "path": "payload/observation.svg",
      "realizationId": "urn:uuid:7d48f623-2937-5379-96c4-5c133308b40b"
    },
    {
      "path": "payload/reference.py",
      "realizationId": "urn:uuid:7e218b08-3be8-5148-b0d5-4842ed5079b4"
    },
    {
      "path": "payload/export.mid",
      "realizationId": "urn:uuid:ab10c8cd-d2cc-516d-981b-42a71823e72a"
    },
    {
      "path": "payload/evidence.txt",
      "realizationId": "urn:uuid:e2945115-a1b6-50c7-9f1d-b89a5d0ef51c"
    },
    {
      "path": "payload/requirements-lock.txt",
      "realizationId": "urn:uuid:f180d6ba-1622-5afe-94ea-c80918b10d33"
    }
  ],
  "formatVersion": "0.6.0",
  "id": "urn:uuid:1e9f0d3f-edfd-553b-8bae-be54b8a76f57",
  "manifestByteSize": 19973,
  "manifestSHA256": "6f995f53dfffbb2ed390d86af4e71d4a07b4d769ba893585b969e70e960cabe7",
  "releaseId": "urn:uuid:f61b4fbc-1bec-5366-aeef-6d54414e12d3",
  "type": "VAOCarrier"
}
